<?xml version="1.0" encoding="UTF-8"?>
<localization lang="Portuguese" translator="UnHoly" xmlns:xsi="http://www.w3.org/2001/XMLSchema-instance" xsi:noNamespaceSchemaLocation="accountmanager.xsd">
	<message id="toolName" text="Administrador de Contas SQL" />

	<message id="yesChar" text="s" />
	<message id="noChar" text="n" />
	<message id="trueString" text="True" />
	<message id="falseString" text="False" />

	<message id="functChooser" text="Selecione uma opção" />
	<message id="functCreateAccount" text="1 - Criar uma nova ou atualizar uma conta existente (alteração de senha e nível de acesso)" />
	<message id="functAccessLevel" text="2 - Alterar nível de acesso" />
	<message id="functDeleteAccount" text="3 - Excluir uma conta existente" />
	<message id="functListAccount" text="4 - Listar contas e níveis de acesso" />
	<message id="functExit" text="5 - Sair" />

	<message id="inputChoice" text="Escolha" />
	<message id="inputUsername" text="Nome de usuário" />
	<message id="inputPassword" text="Senha" />
	<message id="inputAccessLevel" text="Nível de acesso" />

	<message id="functListAccountChooser" text="Por favor selecione um modo de visualização" />
	<message id="functListAccountBanned" text="1 - Listar somente contas banidas (accessLevel &lt; 0)" />
	<message id="functListAccountPrivileged" text="2 - Listar contas de GM ou com privilégios de nível de acesso (accessLevel &gt; 0)" />
	<message id="functListAccountRegular" text="3 - Listar contas de usários (accessLevel = 0)" />
	<message id="functListAccountAll" text="4 - Listar todas as contas" />
	<message id="functListAccountDisplayed" text="Exibindo contas: %d" />

	<message id="functAccessLevelUpdated" text="A conta %s foi atualizada" />
	<message id="functAccessLevelNotExist" text="A conta %s não existe" />

	<message id="functDeleteAccountConfirm" text="Deseja realmente excluir esta conta ? S/N" />
	<message id="functDeleteAccountAbort" text="Exclusão abortada" />
	<message id="functDeleteAccountCancel" text="Exclusão cancelada" />
	<message id="functDeleteAccountChar" text="Excluir personagem %s" />
	<message id="functDeleteAccountClan" text="Excluir Clan %s" />
	<message id="functDeleteAccountComplete" text="A conta %s foi excluída" />
	<message id="functDeleteAccountNotExist" text="A conta %s não existe" />
</localization>